Nome,Tipo,Tamanho,Tendência,PV_médio,PV_dados,CA,Deslocamento,Força,mod_força,Destreza,mod_destreza,Constituição,mod_constituição,Inteligência,mod_inteligência,Sabedoria,mod_sabedoria,Carisma,mod_carisma,Infos,Nível_desafio,XP,Ações,Dano_médio
SENHOR DAS MÚMIAS,Morto-vivo,Médio,leal e mau,97,13d8 + 39,17,6.0,18.0,4.0,10.0,0.0,17.0,3.0,11.0,0.0,18.0,4.0,16.0,3.0," Testes de Resistência Con +8, Int +5, Sab +9, Car +8 Perícias História +5, Religião +5  Vulnerabilidade a Dano fogo  Resistência a Dano concussão, cortante e perfurante de armas não-mágicas Imunidade a Dano necrótico, veneno Imunidade a Condição amedrontado, enfeitiçado, envenenado, exausto, paralisado  Sentidos visão no escuro 18 m, Percepção passiva 14 Idiomas os idiomas que conhecia em vida",15,13000.0,"  Ataques Múltiplos. O senhor das múmias pode usar seu Olhar Desesperador e realiza um ataque com seu punho pútrido.  Punho Pútrido. Ataque Corpo-a-Corpo com Arma: +9 para atingir, alcance 1,5 m, um alvo. Acerto: 14 (3d6 + 4) de dano de concussão mais 21 (6d6) de dano necrótico.",35.0
NAGA DOS OSSOS,Morto-vivo,Grande,leal e mau,58,9d10 + 9,15,9.0,15.0,2.0,16.0,3.0,12.0,1.0,15.0,2.0,15.0,2.0,16.0,3.0,"Imunidade a Dano veneno Imunidade a Condição enfeitiçado, envenenado, exausto, paralisado  Sentidos visão da verdade 18 m, Percepção passiva 12 Idiomas Comum mais um outro idioma",4,1100.0," Mordida. Ataque Corpo-a-Corpo com Arma: +5 para atingir, alcance 3 m, uma criatura. Acerto: 10 (2d6 + 3) de dano perfurante mais 10 (3d6) de dano de veneno.",20.0
NAGA ESPIRITUAL,Monstruosidade,Grande,caótico e mau,75,10d10 + 20,15,12.0,18.0,4.0,17.0,3.0,14.0,2.0,16.0,3.0,15.0,2.0,16.0,3.0,"Testes de Resistência Des +6, Con +5, Sab +5, Car +6 Imunidade a Dano veneno Imunidade a Condição enfeitiçado, envenenado  Sentidos visão da verdade 18 m, Percepção passiva 12 Idiomas Abissal, Comum Nível de Desafio 8 (3.900 XP) Conjuração. A naga é uma conjuradora de 10° nível. Sua habilidade de conjuração é Inteligência (CD de resistência de magia 14, +6 para atingir com ataques com magia) e ela precisa apenas dos componentes verbais para conjurar suas magias. Ela possui as seguintes magias de mago preparadas:  Truques (à vontade): ilusão menor, mãos mágicas, raio de gelo 1° nível (4 espaços): detectar magia, enfeitiçar pessoa, sono 2° nível (3 espaços): detectar pensamentos, imobilizar pessoa 3° nível (3 espaços): relâmpago, respirar na água 4° nível (2 espaços): malogro, porta dimensional 5° nível (2 espaços): dominar pessoa  Rejuvenescimento. Se morrer, a naga retorna a vida em 1d6 dias e recupera todos os seus pontos de vida. Apenas a magia desejo pode impedir esse traço de funcionar. AÇÕES Mordida. Ataque Corpo-a-Corpo com Arma: +7 para atingir, alcance 3 m, uma criatura. Acerto: 7 (1d6 + 4) de dano perfurante e o alvo deve realizar um teste de resistência de Constituição CD 13, sofrendo 31 (7d8) de dano de veneno caso falhe na resistência, ou metade desse dano se obtiver sucesso.                      NAGA GUARDIÃ Monstruosidade Grande, leal e bom Classe de Armadura 18 (armadura natural) Pontos de Vida 127 (15d10 + 45) Deslocamento 12 m FOR 19 (+4) DES 18 (+4) CON 16 (+3) INT 16 (+3) SAB 19 (+4) CAR 18 (+4) Testes de Resistência Des +8, Con +7, Int +7, Sab +8, Car +8 Imunidade a Dano veneno Imunidade a Condição enfeitiçado, envenenado  Sentidos visão da verdade 18 m, Percepção passiva 14 Idiomas Celestial, Comum",8,3900.0," Mordida. Ataque Corpo-a-Corpo com Arma: +7 para atingir, alcance 3 m, uma criatura. Acerto: 7 (1d6 + 4) de dano perfurante e o alvo deve realizar um teste de resistência de Constituição CD 13, sofrendo 31 (7d8) de dano de veneno caso falhe na resistência, ou metade desse dano se obtiver sucesso.",8.0
NAGA GUARDIÃ,Monstruosidade,Grande,leal e bom,127,15d10 + 45,18,12.0,19.0,4.0,18.0,4.0,16.0,3.0,16.0,3.0,19.0,4.0,18.0,4.0,"Testes de Resistência Des +8, Con +7, Int +7, Sab +8, Car +8 Imunidade a Dano veneno Imunidade a Condição enfeitiçado, envenenado  Sentidos visão da verdade 18 m, Percepção passiva 14 Idiomas Celestial, Comum",10,5900.0," Mordida. Ataque Corpo-a-Corpo com Arma: +8 para atingir, alcance 3 m, uma criatura. Acerto: 8 (1d8 + 4) de dano perfurante e o alvo deve realizar um teste de resistência de Constituição CD 15, sofrendo 45 (10d8) de dano de veneno caso falhe na resistência, ou metade desse dano se obtiver sucesso.  Cuspir Veneno. Ataque à Distância com Arma: +8 para atingir, distância 4,5/9 m, uma criatura. Acerto: o alvo deve realizar um teste de resistência de Constituição CD 15, sofrendo 45 (10d8) de dano de veneno caso falhe na resistência, ou metade desse dano se obtiver sucesso.",8.0
NÓTICO,Aberração,Média,neutro e mau,45,6d8 + 18,15,9.0,14.0,2.0,16.0,3.0,16.0,3.0,13.0,1.0,10.0,0.0,8.0,-1.0,"Perícias Arcanismo +3, Furtividade +5, Intuição +4, Percepção +2 Sentidos visão verdadeira 36 m, Percepção passiva 12 Idiomas Subcomum",2,450.0," Ataques Múltiplos. O nótico realiza dois ataques e garra.  Garra. Ataque Corpo-a-Corpo com Arma: +4 para atingir, alcance 1,5 m, um alvo. Acerto: 6 (1d6 + 3) de dano cortante.  Olhar Pútrido. O nótico afeta uma criatura que ele possa ver, a até 9 metros dele. O alvo deve ser bem sucedido num teste de resistência de Constituição CD 12 contra essa magia ou sofrerá 10 (3d6) de dano necrótico.",6.0
ARMADURA ANIMADA,Constructo,Médio,imparcial,33,6d8 + 6,18,7.5,14.0,2.0,11.0,0.0,13.0,1.0,1.0,-5.0,3.0,-4.0,1.0,-5.0,"Imunidade a Dano psíquico, veneno Imunidade a Condição amedrontado, cego, enfeitiçado, envenenado, exausto, paralisado, petrificado, surdo Sentidos percepção às cegas 18 m (cego além desse raio), Percepção passiva 6 Idiomas ",1,200.0," Ataques Múltiplos. A armadura realiza dois ataques corpo-a-corpo.  Pancada. Ataque Corpo-a-Corpo com Arma: +4 para atingir, alcance 1,5 m, um alvo. Acerto: 5 (1d6 + 2) de dano de concussão.",5.0
ESPADA VOADORA,Constructo,Pequeno,imparcial,17,5d6,17,0.0,12.0,1.0,15.0,2.0,11.0,0.0,1.0,-5.0,5.0,-3.0,1.0,-5.0,"Testes de Resistência Des +4 Imunidade a Dano psíquico, veneno Imunidade a Condição amedrontado, cego, enfeitiçado, envenenado, exausto, paralisado, petrificado, surdo Sentidos percepção às cegas 18 m (cego além desse raio), Percepção passiva 7 Idiomas  Nível de Desafio 1/4 (50 XP) Aparência Falsa. Enquanto a espada permanecer imóvel, ela é indistinguível de uma espada normal.  Susceptibilidade à Antimagia. A espada fica incapacitada enquanto estiver na área de um campo antimagia. Se for alvo de dissipar magia, a espada deve ser bem sucedida num teste de resistência de Constituição contra a CD de resistência de magia do conjurador, ou cairá inconsciente por 1 minuto. AÇÕES Espada Longa. Ataque Corpo-a-Corpo com Arma: +3 para atingir, alcance 1,5 m, um alvo. Acerto: 5 (1d8 + 1) de dano cortante.                              TAPETE SUFOCADOR Constructo Grande, imparcial Classe de Armadura 12 Pontos de Vida 33 (6d10) Deslocamento 3 m FOR 17 (+3) DES 14 (+2) CON 10 (+0) INT 1 (5) SAB 3 (4) CAR 1 (5) Imunidade a Dano psíquico, veneno Imunidade a Condição amedrontado, cego, enfeitiçado, envenenado, exausto, paralisado, petrificado, surdo Sentidos percepção às cegas 18 m (cego além desse raio), Percepção passiva 6 Idiomas ",1/4,50.0," Espada Longa. Ataque Corpo-a-Corpo com Arma: +3 para atingir, alcance 1,5 m, um alvo. Acerto: 5 (1d8 + 1) de dano cortante.",5.0
TAPETE SUFOCADOR,Constructo,Grande,imparcial,33,6d10,12,3.0,17.0,3.0,14.0,2.0,10.0,0.0,1.0,-5.0,3.0,-4.0,1.0,-5.0,"Imunidade a Dano psíquico, veneno Imunidade a Condição amedrontado, cego, enfeitiçado, envenenado, exausto, paralisado, petrificado, surdo Sentidos percepção às cegas 18 m (cego além desse raio), Percepção passiva 6 Idiomas ",2,450.0," Sufocar. Ataque Corpo-a-Corpo com Arma: +5 para atingir, alcance 1,5 m, uma criatura Média ou menor. Acerto: a criatura é agarrada (CD 13 para escapar). Até esse agarrão acabar, o alvo fica impedido, cego e sofre risco de sufocar, e o tapete não pode sufocar outro alvo. Além disso, no início de cada turno do alvo, ele sofre 10 (2d6 + 3) de dano de concussão.",10.0
OBJETOS ANIMADOS OBSERVADOR,Aberração,Grande,leal e mau,180,19d10 + 76,18,0.0,10.0,0.0,14.0,2.0,18.0,4.0,17.0,3.0,15.0,2.0,17.0,3.0,"Testes de Resistência Int +8, Sab +7, Car +8 Perícias Percepção +12 Imunidade a Condição caído Sentidos visão no escuro 36 m, Percepção passiva 22 Idiomas Dialeto Subterrâneo, Subcomum",13,10000.0," Mordida. Ataque Corpo-a-Corpo com Arma: +5 para atingir, alcance 1,5 m, um alvo. Acerto: 14 (4d6) de dano perfurante.",14.0
TIRANO DA MORTE,Morto-vivo,Grande,leal e mau,187,25d10 + 50,19,0.0,10.0,0.0,14.0,2.0,14.0,2.0,19.0,4.0,15.0,2.0,19.0,4.0,"Testes de Resistência For +5, Con +7, Int +9, Sab +7, Car +9 Perícias Percepção +12 Imunidade a Dano veneno Imunidade a Condição caído, enfeitiçado, envenenado, exausto, paralisado, petrificado Sentidos visão no escuro 36 m, Percepção passiva 22 Idiomas Dialeto Subterrâneo, Subcomum",14,11500.0," Mordida. Ataque Corpo-a-Corpo com Arma: +5 para atingir, alcance 1,5 m, um alvo. Acerto: 14 (4d6) de dano perfurante.",14.0
ESPECTADOR,Aberração,Média,leal e neutro,39,6d8 + 12,14,0.0,8.0,-1.0,14.0,2.0,14.0,2.0,13.0,1.0,14.0,2.0,11.0,0.0," Perícias Percepção +6 Imunidade a Condição caído Sentidos visão no escuro 36 m, Percepção passiva 16 Idiomas Dialeto Subterrâneo, Subcomum, telepatia 36 m",3,700.0," Aberração Média, leal e neutro  Classe de Armadura 14 (armadura natural) Pontos de Vida 39 (6d8 + 12) Deslocamento 0 m, voo 9 m (planar)  FOR 8 (1) DES 14 (+2) CON 14 (+2) INT 13 (+1) SAB 14 (+2) CAR 11 (+0)  Perícias Percepção +6 Imunidade a Condição caído Sentidos visão no escuro 36 m, Percepção passiva 16 Idiomas Dialeto Subterrâneo, Subcomum, telepatia 36 m Nível de Desafio 3 (700 XP)  AÇÕES  Mordida. Ataque Corpo-a-Corpo com Arma: +1 para atingir, alcance 1,5 m, um alvo. Acerto: 2 (1d6  1) de dano perfurante.",2.0
OGRO,Gigante,Grande,caótico e mau,59,7d10 + 21,11,12.0,19.0,4.0,8.0,-1.0,16.0,3.0,5.0,-3.0,7.0,-2.0,7.0,-2.0,"Sentidos visão no escuro 18 m, Percepção passiva 8 Idiomas Comum, Gigante",2,450.0," Clava Grande. Ataque Corpo-a-Corpo com Arma: +6 para atingir, alcance 1,5 m, um alvo. Acerto: 13 (2d8 + 4) de dano de concussão.  Azagaia. Ataque Corpo-a-Corpo ou à Distância com Arma: +6 para atingir, alcance 1,5 m, distância 9/36 m, um alvo. Acerto: 11 (2d6 + 4) de dano perfurante.",13.0
MEIO-OGRO,Gigante,Grande,qualquer tendência caótica,30,4d10 + 8,12,9.0,17.0,3.0,10.0,0.0,14.0,2.0,7.0,-2.0,9.0,-1.0,10.0,0.0,"Sentidos visão no escuro 18 m, Percepção passiva 9 Idiomas Comum, Gigante",1,200.0," Machado de Batalha. Ataque Corpo-a-Corpo com Arma: +5 para atingir, alcance 1,5 m, um alvo. Acerto: 12 (2d8 + 3) de dano cortante, ou 14 (2d10 + 3) de dano cortante se usado com as duas mãos.  Azagaia. Ataque Corpo-a-Corpo ou à Distância com Arma: +5 para atingir, alcance 1,5 m, distância 9/36 m, um alvo. Acerto: 10 (2d6 + 3) de dano perfurante.",12.0
ONI,Gigante,Grande,leal e mau,110,13d10 + 39,16,9.0,19.0,4.0,11.0,0.0,16.0,3.0,14.0,2.0,12.0,1.0,15.0,1.0," Testes de Resistência Des +3, Con +6, Sab +4, Car +5 Perícias Arcanismo +5, Enganação +8, Percepção +4 Sentidos visão no escuro 18 m, Percepção passiva 14 Idiomas Comum, Gigante",7,2900.0," Gigante Grande, leal e mau  Classe de Armadura 16 (cota de malha)  Pontos de Vida 110 (13d10 + 39) Deslocamento 9 m, voo 9 m Ataques Múltiplos. O oni realiza dois ataques, ambos com suas garras ou com sua glaive.  Garras (Forma de Oni Apenas). Ataque Corpo-a-Corpo com Arma: +7 para atingir, alcance 1,5 m, um alvo. Acerto: 8 (1d8 + 4) de dano cortante.",15.0
COMANDANTE DE GUERRA ORC,Humanoide,Médio,caótico e mau,15,2d8 + 6,13,9.0,16.0,3.0,12.0,1.0,16.0,3.0,7.0,-2.0,11.0,0.0,10.0,0.0,"Perícias Intimidação +2 Sentidos visão no escuro 18 m, Percepção passiva 10 Idiomas Comum, Orc Nível de Desafio 1/2 (100 XP) Agressivo. Com uma ação bônus, o orc pode se mover até metade do seu deslocamento até uma criatura hostil que ele possa ver. AÇÕES Machado Grande. Ataque Corpo-a-Corpo com Arma: +5 para atingir, alcance 1,5 m, um alvo. Acerto: 9 (1d12 + 3) de dano cortante.  Azagaia. Ataque Corpo-a-Corpo ou à Distância com Arma: +5 para atingir, alcance 1,5 m, distância 9/36 m, um alvo. Acerto: 6 (1d6 + 3) de dano perfurante.                            COMANDANTE DE GUERRA ORC  Humanoide Médio (orc), caótico e mau Classe de Armadura 16 (cota de malha) Pontos de Vida 93 (11d8 + 44) Deslocamento 9 m FOR 18 (+4) DES 12 (+1) CON 18 (+4) INT 11 (+0) SAB 11 (+0) CAR 16 (+3) Testes de Resistência For +6, Con +6, Sab +2 Perícias Intimidação +5 Sentidos visão no escuro 18 m, Percepção passiva 10 Idiomas Comum, Orc",1/2,100.0," Machado Grande. Ataque Corpo-a-Corpo com Arma: +5 para atingir, alcance 1,5 m, um alvo. Acerto: 9 (1d12 + 3) de dano cortante.  Azagaia. Ataque Corpo-a-Corpo ou à Distância com Arma: +5 para atingir, alcance 1,5 m, distância 9/36 m, um alvo. Acerto: 6 (1d6 + 3) de dano perfurante.",9.0
ORC,Humanoide,Médio,caótico e mau,15,2d8 + 6,13,9.0,16.0,3.0,12.0,1.0,16.0,3.0,7.0,-2.0,11.0,0.0,10.0,0.0,"Perícias Intimidação +2 Sentidos visão no escuro 18 m, Percepção passiva 10 Idiomas Comum, Orc Nível de Desafio 1/2 (100 XP) Agressivo. Com uma ação bônus, o orc pode se mover até metade do seu deslocamento até uma criatura hostil que ele possa ver. AÇÕES Machado Grande. Ataque Corpo-a-Corpo com Arma: +5 para atingir, alcance 1,5 m, um alvo. Acerto: 9 (1d12 + 3) de dano cortante.  Azagaia. Ataque Corpo-a-Corpo ou à Distância com Arma: +5 para atingir, alcance 1,5 m, distância 9/36 m, um alvo. Acerto: 6 (1d6 + 3) de dano perfurante.                            COMANDANTE DE GUERRA ORC  Humanoide Médio (orc), caótico e mau Classe de Armadura 16 (cota de malha) Pontos de Vida 93 (11d8 + 44) Deslocamento 9 m FOR 18 (+4) DES 12 (+1) CON 18 (+4) INT 11 (+0) SAB 11 (+0) CAR 16 (+3) Testes de Resistência For +6, Con +6, Sab +2 Perícias Intimidação +5 Sentidos visão no escuro 18 m, Percepção passiva 10 Idiomas Comum, Orc",1/2,100.0," Machado Grande. Ataque Corpo-a-Corpo com Arma: +5 para atingir, alcance 1,5 m, um alvo. Acerto: 9 (1d12 + 3) de dano cortante.  Azagaia. Ataque Corpo-a-Corpo ou à Distância com Arma: +5 para atingir, alcance 1,5 m, distância 9/36 m, um alvo. Acerto: 6 (1d6 + 3) de dano perfurante.",9.0
ORC OLHO DE GRUUMSH,Humanoide,Médio,caótico e mau,45,6d8 + 18,16,9.0,16.0,3.0,12.0,1.0,16.0,3.0,9.0,-1.0,13.0,1.0,12.0,1.0,"Perícias Intimidação +3, Religião +1 Sentidos visão no escuro 18 m, Percepção passiva 11 Idiomas Comum, Orc Nível de Desafio 2 (450 XP) Agressivo. Com uma ação bônus, o orc pode se mover até metade do seu deslocamento até uma criatura hostil que ele possa ver.  Conjuração. O orc é um conjurador de 3° nível. Sua habilidade de conjuração é Sabedoria (CD de resistência de magia 11, +3 para atingir com ataques com magia). Ele possui as seguintes magias de clérigo preparadas:  Truques (à vontade): orientação, resistência, taumaturgia 1° nível (4 espaços): bênção, comando 2° nível (2 espaços): arma espiritual (lança), augúrio  Fúria de Gruumsh. O orc causa 4 (1d8) de dano extra quando atinge com um ataque com arma (incluso nos ataques). AÇÕES Lança. Ataque Corpo-a-Corpo ou à Distância com Arma: +5 para atingir, alcance 1,5 m, distância 6/18 m, um alvo. Acerto: 11 (1d6 + 3 mais 1d8) de dano perfurante, ou 12 (2d8 + 4) de dano perfurante se usada com as duas mãos para realizar ataques corpo-a-corpo.                                     OROG Humanoide Médio (orc), caótico e mau Classe de Armadura 18 (placas) Pontos de Vida 42 (5d8 + 20) Deslocamento 9 m FOR 18 (+4) DES 12 (+1) CON 18 (+4) INT 12 (+1) SAB 11 (+0) CAR 12 (+1) Perícias Intimidação +5, Sobrevivência +2 Sentidos visão no escuro 18 m, Percepção passiva 10 Idiomas Comum, Orc",2,450.0," Ataques Múltiplos. O orog realiza dois ataques com machado grande.  Machado Grande. Ataque Corpo-a-Corpo com Arma: +6 para atingir, alcance 1,5 m, um alvo. Acerto: 10 (1d12 + 4) de dano cortante.  Azagaia. Ataque Corpo-a-Corpo ou à Distância com Arma: +6 para atingir, alcance 1,5 m, distância 9/36 m, um alvo. Acerto: 7 (1d6 + 4) de dano perfurante.",11.0
OROG,Humanoide,Médio,caótico e mau,42,5d8 + 20,18,9.0,18.0,4.0,12.0,1.0,18.0,4.0,12.0,1.0,11.0,0.0,12.0,1.0,"Perícias Intimidação +5, Sobrevivência +2 Sentidos visão no escuro 18 m, Percepção passiva 10 Idiomas Comum, Orc",2,450.0," Ataques Múltiplos. O orog realiza dois ataques com machado grande.  Machado Grande. Ataque Corpo-a-Corpo com Arma: +6 para atingir, alcance 1,5 m, um alvo. Acerto: 10 (1d12 + 4) de dano cortante.  Azagaia. Ataque Corpo-a-Corpo ou à Distância com Arma: +6 para atingir, alcance 1,5 m, distância 9/36 m, um alvo. Acerto: 7 (1d6 + 4) de dano perfurante.",10.0
OTYUGH,Aberração,Grande,neutro,114,12d10 + 48,14,9.0,16.0,3.0,11.0,0.0,19.0,4.0,6.0,-2.0,13.0,1.0,6.0,-2.0,"Testes de Resistência Con +7 Sentidos visão no escuro 18 m, Percepção passiva 11 Idiomas Otyugh",5,1800.0," Ataques Múltiplos. O otyugh realiza três ataques: um com sua mordida e dois com seus tentáculos.  Mordida. Ataque Corpo-a-Corpo com Arma: +6 para atingir, alcance 1,5 m, um alvo. Acerto: 12 (2d8 + 3) de dano perfurante.",16.0
PANTERA DESLOCADORA,Monstruosidade,Grande,leal e mau,85,10d10 + 30,13,12.0,18.0,4.0,15.0,2.0,16.0,3.0,6.0,-2.0,12.0,1.0,8.0,-1.0,"Sentidos visão no escuro 18 m, Percepção passiva 11 Idiomas ",3,700.0," Ataques Múltiplos. A pantera realiza dois ataques com seus tentáculos.  Tentáculo. Ataque Corpo-a-Corpo com Arma: +6 para atingir, alcance 3 m, um alvo. Acerto: 7 (1d6 + 4) de dano de concussão mais 3 (1d6) de dano perfurante.",10.0
PÉGASO,Celestial,Grande,caótico e bom,59,7d10 + 21,12,18.0,18.0,4.0,15.0,2.0,16.0,3.0,10.0,0.0,15.0,2.0,13.0,1.0,"Testes de Resistência Des +4, Sab +4, Car +3 Perícias Percepção +6 Sentidos Percepção passiva 16 Idiomas compreende Celestial, Comum, Élfico e Silvestre, mas não pode falar ",2,450.0," Cascos. Ataque Corpo-a-Corpo com Arma: +6 para atingir, alcance 1,5 m, um alvo. Acerto: 11 (2d6 + 4) de dano de concussão.",11.0
PERFURADOR,Monstruosidade,Média,imparcial,22,3d8 + 9,15,1.5,10.0,0.0,13.0,1.0,16.0,3.0,1.0,-5.0,7.0,-2.0,3.0,-4.0,"Perícias Furtividade +5 Sentidos percepção às cegas 9 m, visão no escuro 18 m, Percepção passiva 8 Idiomas ",1/2,100.0,"Queda. Ataque Corpo-a-Corpo com Arma: +3 para atingir, uma criatura diretamente abaixo do perfurador. Acerto: 3 (1d6) de dano perfurante para cada 3 metros de queda, até 21 (6d6). Errar: O perfurador sofre metade do dano normal de queda para a distância caída.",3.0
PERYTON,Monstruosidade,Média,caótico e mau,33,6d8 + 6,13,6.0,16.0,3.0,12.0,1.0,13.0,1.0,9.0,-1.0,12.0,1.0,10.0,0.0,"Perícias Percepção +5 Resistência a Dano concussão, cortante e perfurante de armas não-mágicas Sentidos Percepção passiva 15 Idiomas compreende Comum e Élfico, mas não pode falar",2,450.0," Ataques Múltiplos. O peryton realiza um ataque de chifre e um ataque de garras.  Chifre. Ataque Corpo-a-Corpo com Arma: +5 para atingir, alcance 1,5 m, um alvo. Acerto: 7 (1d8 + 3) de dano perfurante.  Garras. Ataque Corpo-a-Corpo com Arma: +5 para atingir, alcance 1,5 m, um alvo. Acerto: 8 (2d4 + 3) de dano perfurante.",8.0
PESADELO,Corruptor,Grande,neutro e mau,68,8d10 + 24,13,18.0,18.0,4.0,15.0,2.0,16.0,3.0,10.0,0.0,13.0,1.0,15.0,2.0,"Imunidade a Dano fogo Sentidos Percepção passiva 11 Idiomas compreende Abissal, Comum e Infernal, mas não pode falar",3,700.0," Cascos. Ataque Corpo-a-Corpo com Arma: +6 para atingir, alcance 1,5 m, um alvo. Acerto: 13 (2d8 + 4) de dano de concussão mais 7 (2d6) de dano de fogo.",20.0
PIXIE,Fada,Miúda,neutro e bom,1,1d4 - 1,15,3.0,2.0,-4.0,20.0,5.0,8.0,-1.0,10.0,0.0,14.0,2.0,15.0,2.0,"Perícias Furtividade +7, Percepção +4 Sentidos Percepção passiva 14 Idiomas Silvestre",1/4,50.0,Invisibilidade Superior. O pixie torna-se magicamente invisível até sua concentração acabar (como se estivesse se concentrando em uma magia). Qualquer equipamento que o pixie esteja vestindo ou carregando fica invisível com ele.,0.0
POVO DO MAR,Humanoide,Médio,neutro,11,2d8 + 2,11,3.0,10.0,0.0,13.0,1.0,12.0,1.0,11.0,0.0,11.0,0.0,12.0,1.0,"Perícias Percepção +2 Sentidos Percepção passiva 12 Idiomas Aquan, Comum",1/8,25.0,"Lança. Ataque Corpo-a-Corpo ou à Distância com Arma: +2 para
atingir, alcance 1,5 m, distância 6/18 m, um alvo. Acerto: 3 (1d6)
de dano perfurante, ou 4 (1d8) de dano perfurante se usada com
as duas mãos para realizar ataques corpo-a-corpo.",4.0
POVO LAGARTO,Humanoide,Médio,neutro,22,4d8 + 4,15,9.0,15.0,2.0,10.0,0.0,13.0,1.0,7.0,-2.0,12.0,1.0,7.0,-2.0,"Perícias Furtividade +4, Percepção +3, Sobrevivência +5  Sentidos Percepção passiva 13 Idiomas Dracônico",1/2,100.0," Ataques Múltiplos. O povo lagarto realiza dois ataques, cada um com uma arma diferente.  Mordida. Ataque Corpo-a-Corpo com Arma: +4 para atingir, alcance 1,5 m, um alvo. Acerto: 5 (1d6 + 2) de dano perfurante.  Clava Pesada. Ataque Corpo-a-Corpo com Arma: +4 para atingir, alcance 1,5 m, um alvo. Acerto: 5 (1d6 + 2) de dano de concussão.  Azagaia. Ataque Corpo-a-Corpo ou à Distância com Arma: +4 para atingir, alcance 1,5 m, distância 9/36 m, um alvo. Acerto: 5 (1d6 + 2) de dano perfurante.",5.0
RAINHA DO POVO LAGARTO,Humanoide,Médio,neutro,27,5d8 + 5,13,9.0,15.0,2.0,10.0,0.0,13.0,1.0,10.0,0.0,15.0,2.0,8.0,-1.0,"Perícias Furtividade +4, Percepção +4, Sobrevivência +6  Sentidos Percepção passiva 14 Idiomas Dracônico Nível de Desafio 2 (450 XP) Prender a Respiração. O povo lagarto pode prender a respiração por 15 minutos.  Conjuração (Forma de Povo Lagarto Apenas). O povo lagarto é um conjurador de 5° nível. Sua habilidade de conjuração é Sabedoria (CD de resistência de magia 12, +4 para atingir com ataques de magia):  Truques (à vontade): druidismo, criar chamas, chicote de espinhos 1° nível (4 espaços): constrição, nevoa obscurecente 2° nível (3 espaços): esquentar metal, crescer espinhos 3° nível (2 espaços): conjurar animais (répteis apenas), ampliar plantas AÇÕES Ataques Múltiplos (Forma de Povo Lagarto Apenas). O povo lagarto realiza dois ataques: um com sua mordida e um com suas garras.  Mordida. Ataque Corpo-a-Corpo com Arma: +4 para atingir, alcance 1,5 m, um alvo. Acerto: 5 (1d6 + 2) de dano perfurante, ou 7 (1d10 + 2) de dano perfurante na forma de crocodilo. Se o povo lagarto estiver na forma de crocodilo e o alvo for uma criatura Grande ou menor, o alvo fica agarrado (CD 12 para escapar). Até esse agarrão acabar, o alvo está impedido e o povo lagarto não pode morder outro alvo. Se o povo lagarto voltar para sua forma verdadeira, o agarrão acaba.  Garras (Forma de Povo Lagarto Apenas).  Ataque Corpo-a-Corpo com Arma: +4 para atingir, alcance 1,5 m, um alvo. Acerto: 4 (1d4 + 2) de dano cortante.  Mudar Forma (Recarrega após um Descanso Curto ou Longo). O povo lagarto se metamorfoseia magicamente em um crocodilo, permanecendo nessa forma por até 1 hora. Ele pode voltar para sua forma verdadeira com uma ação bônus. Suas estatísticas, além do tamanho, são as mesmas em cada forma. Qualquer equipamento que ele esteja vestindo ou carregando não é transformado. Ele volta a sua forma verdadeira se morrer.                REI/RAINHA DO POVO LAGARTO Humanoide Médio (povo lagarto), caótico e mau Classe de Armadura 15 (armadura natural) Pontos de Vida 78 (12d8 + 24) Deslocamento 9 m, natação 9 m FOR 17 (+3) DES 12 (+1) CON 15 (+2) INT 11 (+0) SAB 11 (+0) CAR 15 (+2) Testes de Resistência Con +4, Sab +2  Perícias Furtividade +5, Percepção +4, Sobrevivência +4  Imunidade a Condição amedrontado  Sentidos visão no escuro 18 m, Percepção passiva 14 Idiomas Dracônico",2,450.0," Ataques Múltiplos. O povo lagarto realiza dois ataques: um com sua mordida e um com suas garras ou tridente, ou dois ataques corpo-a-corpo com seu tridente.  Mordida. Ataque Corpo-a-Corpo com Arma: +5 para atingir, alcance 1,5 m, um alvo. Acerto: 6 (1d6 + 3) de dano perfurante.  Garras.  Ataque Corpo-a-Corpo com Arma: +5 para atingir, alcance 1,5 m, um alvo. Acerto: 5 (1d4 + 3) de dano cortante.",5.0
